{
  "version": 1,
  "createdAt": "2026-05-13T22:15:20.116Z",
  "updatedAt": "2026-05-13T22:22:35.085Z",
  "currentRound": 1,
  "mode": "full",
  "stages": {
    "stage_0_taxonomy": {
      "status": "completed",
      "userApprovedAt": "2026-05-13T22:15:20.118Z",
      "artifactPath": "content/_taxonomy.json",
      "completedAt": "2026-05-13T22:15:20.118Z"
    },
    "stage_5_connections": {
      "status": "completed",
      "artifactPath": "content/_connections.json",
      "completedAt": "2026-05-13T22:22:35.084Z"
    }
  },
  "topics": {
    "authentication": {
      "phase": "security-and-identity",
      "stages": {
        "research": {
          "status": "completed",
          "round": 1,
          "agentRunIds": [
            "agent-a-auth"
          ],
          "completedAt": "2026-05-13T22:22:34.999Z"
        },
        "consistency": {
          "status": "completed",
          "round": 1,
          "completedAt": "2026-05-13T22:22:35.000Z"
        },
        "adversarial": {
          "status": "completed",
          "round": 1,
          "completedAt": "2026-05-13T22:22:35.001Z"
        },
        "liveness": {
          "status": "completed",
          "round": 1,
          "completedAt": "2026-05-13T22:22:35.001Z"
        },
        "stabilized": true
      },
      "lastSwapAt": null,
      "retryCounts": {}
    },
    "access-control": {
      "phase": "security-and-identity",
      "stages": {
        "research": {
          "status": "completed",
          "round": 1,
          "agentRunIds": [
            "agent-access-control"
          ],
          "completedAt": "2026-05-13T22:22:35.003Z"
        },
        "consistency": {
          "status": "completed",
          "round": 1,
          "completedAt": "2026-05-13T22:22:35.003Z"
        },
        "adversarial": {
          "status": "completed",
          "round": 1,
          "completedAt": "2026-05-13T22:22:35.003Z"
        },
        "liveness": {
          "status": "completed",
          "round": 1,
          "completedAt": "2026-05-13T22:22:35.004Z"
        },
        "stabilized": true
      },
      "lastSwapAt": null,
      "retryCounts": {}
    },
    "secrets-management": {
      "phase": "security-and-identity",
      "stages": {
        "research": {
          "status": "completed",
          "round": 1,
          "agentRunIds": [
            "agent-secrets-management"
          ],
          "completedAt": "2026-05-13T22:22:35.006Z"
        },
        "consistency": {
          "status": "completed",
          "round": 1,
          "completedAt": "2026-05-13T22:22:35.006Z"
        },
        "adversarial": {
          "status": "completed",
          "round": 1,
          "completedAt": "2026-05-13T22:22:35.006Z"
        },
        "liveness": {
          "status": "completed",
          "round": 1,
          "completedAt": "2026-05-13T22:22:35.007Z"
        },
        "stabilized": true
      },
      "lastSwapAt": null,
      "retryCounts": {}
    },
    "rate-limiting": {
      "phase": "security-and-identity",
      "stages": {
        "research": {
          "status": "completed",
          "round": 1,
          "agentRunIds": [
            "agent-rate-limiting"
          ],
          "completedAt": "2026-05-13T22:22:35.008Z"
        },
        "consistency": {
          "status": "completed",
          "round": 1,
          "completedAt": "2026-05-13T22:22:35.008Z"
        },
        "adversarial": {
          "status": "completed",
          "round": 1,
          "completedAt": "2026-05-13T22:22:35.008Z"
        },
        "liveness": {
          "status": "completed",
          "round": 1,
          "completedAt": "2026-05-13T22:22:35.008Z"
        },
        "stabilized": true
      },
      "lastSwapAt": null,
      "retryCounts": {}
    },
    "cookies": {
      "phase": "security-and-identity",
      "stages": {
        "research": {
          "status": "completed",
          "round": 1,
          "agentRunIds": [
            "agent-cookies"
          ],
          "completedAt": "2026-05-13T22:22:35.010Z"
        },
        "consistency": {
          "status": "completed",
          "round": 1,
          "completedAt": "2026-05-13T22:22:35.010Z"
        },
        "adversarial": {
          "status": "completed",
          "round": 1,
          "completedAt": "2026-05-13T22:22:35.010Z"
        },
        "liveness": {
          "status": "completed",
          "round": 1,
          "completedAt": "2026-05-13T22:22:35.011Z"
        },
        "stabilized": true
      },
      "lastSwapAt": null,
      "retryCounts": {}
    },
    "gdpr-ccpa": {
      "phase": "security-and-identity",
      "stages": {
        "research": {
          "status": "completed",
          "round": 1,
          "agentRunIds": [
            "agent-gdpr-ccpa"
          ],
          "completedAt": "2026-05-13T22:22:35.012Z"
        },
        "consistency": {
          "status": "completed",
          "round": 1,
          "completedAt": "2026-05-13T22:22:35.012Z"
        },
        "adversarial": {
          "status": "completed",
          "round": 1,
          "completedAt": "2026-05-13T22:22:35.012Z"
        },
        "liveness": {
          "status": "completed",
          "round": 1,
          "completedAt": "2026-05-13T22:22:35.012Z"
        },
        "stabilized": true
      },
      "lastSwapAt": null,
      "retryCounts": {}
    },
    "payments": {
      "phase": "money-and-data",
      "stages": {
        "research": {
          "status": "completed",
          "round": 1,
          "agentRunIds": [],
          "completedAt": "2026-05-13T22:22:35.013Z"
        },
        "consistency": {
          "status": "completed",
          "round": 1,
          "completedAt": "2026-05-13T22:22:35.013Z"
        },
        "adversarial": {
          "status": "completed",
          "round": 1,
          "completedAt": "2026-05-13T22:22:35.013Z"
        },
        "liveness": {
          "status": "completed",
          "round": 1,
          "completedAt": "2026-05-13T22:22:35.014Z"
        },
        "stabilized": true
      },
      "lastSwapAt": null,
      "retryCounts": {}
    },
    "billing-logic": {
      "phase": "money-and-data",
      "stages": {
        "research": {
          "status": "completed",
          "round": 1,
          "agentRunIds": [],
          "completedAt": "2026-05-13T22:22:35.014Z"
        },
        "consistency": {
          "status": "completed",
          "round": 1,
          "completedAt": "2026-05-13T22:22:35.015Z"
        },
        "adversarial": {
          "status": "completed",
          "round": 1,
          "completedAt": "2026-05-13T22:22:35.015Z"
        },
        "liveness": {
          "status": "completed",
          "round": 1,
          "completedAt": "2026-05-13T22:22:35.015Z"
        },
        "stabilized": true
      },
      "lastSwapAt": null,
      "retryCounts": {}
    },
    "subscription-states": {
      "phase": "money-and-data",
      "stages": {
        "research": {
          "status": "completed",
          "round": 1,
          "agentRunIds": [],
          "completedAt": "2026-05-13T22:22:35.016Z"
        },
        "consistency": {
          "status": "completed",
          "round": 1,
          "completedAt": "2026-05-13T22:22:35.017Z"
        },
        "adversarial": {
          "status": "completed",
          "round": 1,
          "completedAt": "2026-05-13T22:22:35.017Z"
        },
        "liveness": {
          "status": "completed",
          "round": 1,
          "completedAt": "2026-05-13T22:22:35.017Z"
        },
        "stabilized": true
      },
      "lastSwapAt": null,
      "retryCounts": {}
    },
    "idempotency": {
      "phase": "money-and-data",
      "stages": {
        "research": {
          "status": "completed",
          "round": 1,
          "agentRunIds": [],
          "completedAt": "2026-05-13T22:22:35.018Z"
        },
        "consistency": {
          "status": "completed",
          "round": 1,
          "completedAt": "2026-05-13T22:22:35.018Z"
        },
        "adversarial": {
          "status": "completed",
          "round": 1,
          "completedAt": "2026-05-13T22:22:35.019Z"
        },
        "liveness": {
          "status": "completed",
          "round": 1,
          "completedAt": "2026-05-13T22:22:35.019Z"
        },
        "stabilized": true
      },
      "lastSwapAt": null,
      "retryCounts": {}
    },
    "data-integrity": {
      "phase": "money-and-data",
      "stages": {
        "research": {
          "status": "completed",
          "round": 1,
          "agentRunIds": [],
          "completedAt": "2026-05-13T22:22:35.019Z"
        },
        "consistency": {
          "status": "completed",
          "round": 1,
          "completedAt": "2026-05-13T22:22:35.020Z"
        },
        "adversarial": {
          "status": "completed",
          "round": 1,
          "completedAt": "2026-05-13T22:22:35.020Z"
        },
        "liveness": {
          "status": "completed",
          "round": 1,
          "completedAt": "2026-05-13T22:22:35.020Z"
        },
        "stabilized": true
      },
      "lastSwapAt": null,
      "retryCounts": {}
    },
    "schema-migrations": {
      "phase": "money-and-data",
      "stages": {
        "research": {
          "status": "completed",
          "round": 1,
          "agentRunIds": [],
          "completedAt": "2026-05-13T22:22:35.021Z"
        },
        "consistency": {
          "status": "completed",
          "round": 1,
          "completedAt": "2026-05-13T22:22:35.021Z"
        },
        "adversarial": {
          "status": "completed",
          "round": 1,
          "completedAt": "2026-05-13T22:22:35.022Z"
        },
        "liveness": {
          "status": "completed",
          "round": 1,
          "completedAt": "2026-05-13T22:22:35.022Z"
        },
        "stabilized": true
      },
      "lastSwapAt": null,
      "retryCounts": {}
    },